{
  "profile": "silver",
  "version": "1.3.0",
  "implementation": {"name": "lap-pep-gateway", "commit": "unknown"},
  "enforcement": {
    "tokens": true,
    "replay": true,
    "budgets": true,
    "sessions": true,
    "receipts": true,
    "audit_log": true
  },
  "identity": {"mode": "api_key", "details": "scoped per-agent keys"},
  "boundary": {
    "tools_not_directly_reachable": true,
    "tool_credentials_held_by_gateway": true,
    "agent_egress_restricted": true
  },
  "signing": {"keyset": true, "external_signer": false, "rotation_supported": true},
  "approvals": {"reviewer_keyset_configured": true}
}
